{
  "project_name": "url-shortener-api",
  "created_at": "2026-02-20T09:00:00Z",
  "version": "3.0",
  "orchestration_mode": "agents",
  "selected_phases": ["investigation", "planning", "implementation", "code-review", "testing"],
  "current_phase": "planning",
  "phases": {
    "investigation": {
      "status": "completed",
      "completed_at": "2026-02-20T10:15:00Z",
      "outputs": [
        "spec.md",
        "docs/plans/2026-02-20-redirect-counter-race-investigation.md"
      ],
      "issue_type": "bug",
      "root_cause": "Race condition in concurrent URL redirect counter updates — two requests read the same counter value and write back stale increments"
    },
    "planning": {
      "status": "in-progress"
    },
    "implementation": {
      "status": "pending"
    },
    "code-review": {
      "status": "pending"
    },
    "testing": {
      "status": "pending"
    }
  }
}
